{
  "schema_version": "1.0.0",
  "run_id": "phase0.voxtral-mini-4b-realtime-2602.runtime-evaluation-1",
  "captured_at": "2026-07-20T19:00:49.978Z",
  "source_revision": "13419d82fade6d90fb41acb35d1ae59d42b8460c",
  "fixture_id": null,
  "candidate": {
    "task": "asr",
    "model": {
      "id": "mistralai/Voxtral-Mini-4B-Realtime-2602",
      "revision": "2769294da9567371363522aac9bbcfdd19447add",
      "quantization": "BF16 Safetensors with 4429679360 parameters",
      "license": "Apache-2.0"
    },
    "runtime": {
      "id": "mlx-audio-voxtral-realtime-reference",
      "version": "mlx-audio 0.4.5@64e8416c303fb3b3463dab8eb4ebd78c55a87c1a over official MLX 0.32.0",
      "boundary": "pinned Python reference runner on Apple Silicon; not an accepted product dependency or Rust boundary"
    },
    "options": {
      "evaluated_at": "2026-07-20",
      "model_format": "Safetensors",
      "supported_languages": 13,
      "official_source": "https://huggingface.co/mistralai/Voxtral-Mini-4B-Realtime-2602/tree/2769294da9567371363522aac9bbcfdd19447add",
      "mlx_conversion": "mlx-community/Voxtral-Mini-4B-Realtime-2602-4bit@fdebf7b2af834a1db4b8a3c99ab7480b333adf9e",
      "official_runtimes": [
        "vLLM realtime endpoint",
        "Transformers >=5.2.0"
      ],
      "additional_current_paths": [
        "ExecuTorch (publisher-linked, untested)",
        "pure C with Metal/MPS",
        "community MLX",
        "community Rust"
      ],
      "redistribution": "allowed under Apache-2.0",
      "llama_cpp_assumption": "none; current official vLLM realtime support was recorded instead"
    }
  },
  "host": {
    "id": "mac-studio-m1-ultra-local",
    "chip": "Apple M1 Ultra",
    "memory_bytes": 68719476736,
    "os": "macOS 26.5.2 (25F84)",
    "architecture": "arm64",
    "power_state": "unknown"
  },
  "measurements": {
    "quality": { "wer": null, "cer": null },
    "timing": {
      "audio_duration_ms": null,
      "cold_load_ms": null,
      "warm_inference_ms": null,
      "real_time_factor": null
    },
    "resources": {
      "peak_memory_bytes": null,
      "model_size_bytes": null,
      "binary_size_bytes": null
    },
    "streaming": {
      "supported": false,
      "first_result_ms": null,
      "update_count": null,
      "volatile_update_count": null,
      "final_update_count": null,
      "revoke_count": null,
      "timestamps": "unknown"
    },
    "energy": {
      "method": "not-measured",
      "sample_rate_ms": null,
      "sample_count": null,
      "energy_joules": null,
      "raw_artifact": null,
      "notes": "No accepted Apple-local runtime reached inference."
    }
  },
  "engineering_cost": {
    "conversion_effort": "The pinned 4-bit MLX conversion proves the causal encoder, adapter, delay-conditioned decoder, tokenizer, and weights on Apple Silicon. Product work remains around an accepted repository-owned or narrower external boundary.",
    "update_cost": "Track the official Transformers architecture plus the pinned MLX oracle; decide between a direct official-MLX adapter and the substantially smaller pure-C/MPS boundary only after quality and streaming lifecycle gates.",
    "packaging_cost": "The measured 4-bit snapshot is 3.15 GB and peaked near 5.8 GB of MLX allocation. The official BF16 repository remains about 17.77 GB and the recommended vLLM path requires at least 16 GB GPU memory."
  },
  "reproduction": {
    "command": "CUTTLEDOC_VOXTRAL_REALTIME_DELAY_MS=480 bash scripts/run-voxtral-realtime-mlx-reference.sh; repeat with 2400",
    "raw_artifacts": [
      "benchmarks/raw/phase0.voxtral-realtime-mlx-reference-480ms.audiobook-pilot-1/result.json",
      "benchmarks/raw/phase0.voxtral-realtime-mlx-reference-2400ms.audiobook-pilot-1/result.json"
    ]
  },
  "result": {
    "status": "partial",
    "blocker": "Apple-local reference quality is now measured, but live input streaming, cancellation, lifecycle behavior, and an accepted production boundary are not. The Python MLX oracle cannot be promoted directly under ADR-0005.",
    "observations": [
      "The old vLLM/CUDA-only disposition was stale: official Transformers support and publisher-linked ExecuTorch, C/MPS, MLX, and Rust paths now exist.",
      "At 480 ms, the 15-clip audiobook pilot reached 5.84% macro WER and 2.72% German WER. It beat the existing Whisper result in English and Portuguese while trailing it in Spanish and French.",
      "At 2400 ms, macro WER improved to 4.25%, German to 0.68%, Spanish to 5.31%, and French to 1.74%; English and Portuguese regressed. Delay therefore belongs in the language-specific selection contract.",
      "The 2400 ms development result is slightly below the existing Whisper macro WER of 4.49%, but the pilot is too small and already development-exposed for product selection.",
      "The quality runner consumes complete clips. It does not yet prove live-input first-result latency despite the model and reference implementation exposing stateful streaming."
    ]
  }
}
