{
  "schema_version": "1.0.0",
  "run_id": "phase0.apple-speech.partial-1",
  "captured_at": "2026-07-17T00:29:37+02:00",
  "source_revision": "22c4dd5ed7c589a492460ef9581330ece432b25f",
  "fixture_id": "apple-say-en-us-smoke",
  "candidate": {
    "task": "asr",
    "model": {
      "id": "apple-speechtranscriber-system-model",
      "revision": "system-managed; exact asset revision not exposed by spike",
      "quantization": "system-managed",
      "license": "Apple platform asset; not redistributed"
    },
    "runtime": {
      "id": "apple-speechanalyzer",
      "version": "macOS 26.5.2 Speech framework",
      "boundary": "Repository-owned Swift C ABI"
    },
    "options": { "locale": "en-US", "preset": "transcription" }
  },
  "host": {
    "id": "local-macos-arm64",
    "chip": "not captured by the initial spike",
    "memory_bytes": null,
    "os": "macOS 26.5.2 (25F84)",
    "architecture": "arm64",
    "power_state": "unknown"
  },
  "measurements": {
    "quality": { "wer": null, "cer": null },
    "timing": { "audio_duration_ms": null, "cold_load_ms": null, "warm_inference_ms": null, "real_time_factor": null },
    "resources": { "peak_memory_bytes": null, "model_size_bytes": null, "binary_size_bytes": null },
    "streaming": { "supported": false, "first_result_ms": null, "update_count": 1, "volatile_update_count": 0, "final_update_count": 1, "revoke_count": 0, "timestamps": "none" },
    "energy": { "method": "not-measured", "sample_rate_ms": null, "sample_count": null, "energy_joules": null, "raw_artifact": null, "notes": "Initial file-transcription boundary run only." }
  },
  "engineering_cost": {
    "conversion_effort": "No model conversion; system asset acquisition remains to be characterized.",
    "update_cost": "Bound to the macOS 26 Speech framework and repository-owned Swift shim.",
    "packaging_cost": "Observed 91 KiB Swift library plus 486 KiB Rust caller before system frameworks."
  },
  "reproduction": { "command": "bash scripts/run-apple-speech-spike.sh", "raw_artifacts": ["docs/spikes/apple-speech-swift-shim.md"] },
  "result": {
    "status": "partial",
    "blocker": "The smoke fixture is synthetic and not quality-eligible; timing, memory, energy, timestamps, confidence, volatile updates, and fresh-host asset behavior were not captured.",
    "observations": ["Observed transcript: Cuddle Dock is testing offline speech transcription on Apple Silicon."]
  }
}
