{
  "schema_version": "1.0.0",
  "run_id": "phase0.whisper-coreml-whispercpp.blocked-1",
  "captured_at": "2026-07-17T00:29:37+02:00",
  "source_revision": "22c4dd5ed7c589a492460ef9581330ece432b25f",
  "fixture_id": null,
  "candidate": {
    "task": "asr",
    "model": {
      "id": "whisper-large-v3-turbo",
      "revision": "pending exact CoreML and GGML artifact pins",
      "quantization": "pending",
      "license": "pending per-artifact audit"
    },
    "runtime": {
      "id": "coreml-plus-whisper.cpp",
      "version": "whisper.cpp v1.8.2 compatibility baseline",
      "boundary": "CoreML encoder plus pinned whisper.cpp decoder boundary"
    },
    "options": {}
  },
  "host": {
    "id": "local-macos-arm64",
    "chip": "not captured for blocked bootstrap record",
    "memory_bytes": null,
    "os": "macOS 26.5.2 (25F84)",
    "architecture": "arm64",
    "power_state": "unknown"
  },
  "measurements": {
    "quality": { "wer": null, "cer": null },
    "timing": { "audio_duration_ms": null, "cold_load_ms": null, "warm_inference_ms": null, "real_time_factor": null },
    "resources": { "peak_memory_bytes": null, "model_size_bytes": null, "binary_size_bytes": null },
    "streaming": { "supported": false, "first_result_ms": null, "update_count": null, "volatile_update_count": null, "final_update_count": null, "revoke_count": null, "timestamps": "unknown" },
    "energy": { "method": "not-measured", "sample_rate_ms": null, "sample_count": null, "energy_joules": null, "raw_artifact": null, "notes": "No baseline runner in this repository yet." }
  },
  "engineering_cost": {
    "conversion_effort": "Pending audit and import of the existing split encoder/decoder pipeline.",
    "update_cost": "Pending comparison against the pinned whisper.cpp baseline.",
    "packaging_cost": "Pending dual-artifact manifest and size measurement."
  },
  "reproduction": { "command": "not available: baseline runner must be imported", "raw_artifacts": [] },
  "result": {
    "status": "blocked",
    "blocker": "The repository does not yet contain the Whisper CoreML encoder, GGML decoder artifact, or the compatibility runner needed for a controlled baseline.",
    "observations": []
  }
}
